{
  "experiment_id": "EXP-20260316-001",
  "date": "2026-03-16",
  "owner": "sage",
  "issue_id": "MOESD-001",
  "branch": "",
  "commit_hash": "",
  "tag": "",
  "status": "planned",
  "optimization_target": "",
  "optimization_module": "",
  "change_summary": "",
  "hypothesis": "",
  "model": "",
  "spec_method": "",
  "num_speculative_tokens": 0,
  "policy_name": "",
  "workload_profile": "",
  "hardware_profile": "",
  "gpu_type": "",
  "gpu_count": 1,
  "memory_budget": "",
  "cuda_version": "",
  "vllm_version": "",
  "speculators_version": "",
  "seed": 42
}